<?xml version="1.0" encoding="UTF-8"?>
<xs:schema xmlns:xs="http://www.w3.org/2001/XMLSchema"
    xmlns:vc="http://www.w3.org/2007/XMLSchema-versioning" elementFormDefault="qualified"
    vc:minVersion="1.1" xmlns:zah="http://www.xml.proj/gradj/zahtev"
    targetNamespace="http://www.xml.proj/gradj/zahtev">

    <xs:element name="Zahtev">
        <xs:complexType>
            <xs:sequence>
                <xs:element name="Podnosilac_zahteva">
                    <xs:complexType>
                        <xs:sequence>
                            <xs:element name="Ime_i_prezime" type="xs:string"/>
                            <xs:element name="Datum_rodjenja" type="xs:date"/>
                            <xs:element name="Pol">
                                <xs:simpleType>
                                    <xs:restriction base="xs:string">
                                        <xs:enumeration value="Muski"/>
                                        <xs:enumeration value="Zenski"/>
                                    </xs:restriction>
                                </xs:simpleType>
                            </xs:element>
                            <xs:element name="JMBG">
                                <xs:complexType>
                                    <xs:simpleContent>
                                        <xs:extension base="xs:string">
                                            <xs:attribute name="property"/>
                                        </xs:extension>
                                    </xs:simpleContent>
                                </xs:complexType>
                            </xs:element>
                            <xs:element name="Broj_pasosa"/>
                        </xs:sequence>
                    </xs:complexType>
                </xs:element>
                <xs:element name="Razlog_za_podnosenje_zahteva">
                    <xs:simpleType>
                        <xs:restriction base="xs:string">
                            <xs:maxLength value="100"/>
                        </xs:restriction>
                    </xs:simpleType>
                </xs:element>
                <xs:element name="Mesto">
                    <xs:complexType>
                        <xs:simpleContent>
                            <xs:extension base="xs:string">
                                <xs:attribute name="property"/>
                            </xs:extension>
                        </xs:simpleContent>
                    </xs:complexType>
                </xs:element>
                <xs:element name="Datum">
                    <xs:complexType>
                        <xs:simpleContent>
                            <xs:extension base="xs:date">
                                <xs:attribute name="property"/>
                            </xs:extension>
                        </xs:simpleContent>
                    </xs:complexType>
                </xs:element>
            </xs:sequence>
            <xs:attribute name="about"/>
        </xs:complexType>
    </xs:element>
</xs:schema>
