<?xml version="1.0" encoding="UTF-8"?>
<Zahtev xmlns="http://www.xml.proj/gradj/zahtev"
    xmlns:xsi="http://www.w3.org/2001/XMLSchema-instance"
    xsi:schemaLocation="http://www.xml.proj/gradj/zahtev ../xsd/zahtev.xsd"
    xmlns:pred="http://www.xml.proj/gradj/rdf/predicate/"
    about = "http://www.xml.proj/gradj/zahtev/1122">
    <Podnosilac_zahteva>
        <Ime_i_prezime>Imenko PrezimeniÄ‡</Ime_i_prezime>
        <Datum_rodjenja>1980-01-01</Datum_rodjenja>
        <Pol>Muski</Pol>
        <JMBG property="pred:zahteva">0101980660066</JMBG>
        <Broj_pasosa>0101</Broj_pasosa>
    </Podnosilac_zahteva>
    <Razlog_za_podnosenje_zahteva>Neki tekst dsadasdsa</Razlog_za_podnosenje_zahteva>
    <Mesto property="pred:seNalazi">Novi Sad</Mesto>
    <Datum property="pred:kreiran">2021-12-01</Datum>
</Zahtev>